Title,Date,Blurb
"MPD knew of past allegations before cop killed wife, family says","Apr 26, 2017",
Keillor: Christmas lives on,"Dec 24, 2016",
A final taste of summer: Food trucks and the State Fair,"Aug 4, 2016",
Haynes: The challenge of fake news,"Dec 16, 2016",
This day in history — March 12,"Mar 10, 2016",
"Cardinals 4, Brewers 1: Clutch hitting takes night off","Apr 23, 2017",
Gary D’Amato: Suzy Favor Hamilton’s long journey to get to a healthier place,"Mar 14, 2016",
Brewers fail to do the little things against Cardinals,"Apr 23, 2017",
This day in history — Feb. 20,"Feb 18, 2016",
Book Review: 'Romeo and/or Juliet' gives lovers and readers 46 quadrillion options,"Jul 15, 2016",
"New this week: 'Light Between Oceans,' 'Morgan'","Sep 1, 2016",
New album releases for Feb. 24,"Feb 23, 2017",
New album releases for Feb. 24,"Feb 23, 2017",
Thieme: A traumatic time for the body politic,"Nov 20, 2016",
Parker: The mourning after,"Nov 9, 2016",
"Beck, Real Estate among new Milwaukee concerts","Jun 1, 2017",
New state veterans secretary is Iraq War vet,"Mar 24, 2017",
Ambrose: Give Trump a chance,"Nov 10, 2016",
Schneider: Clarke stealing Trump's playbook,"Mar 21, 2017",
Local historian featured in World War I documentary on PBS,"Mar 27, 2017",
Laffy Taffy is Wisconsin's favorite Halloween candy,"Oct 20, 2016",
Local historian featured in World War I documentary on PBS,"Mar 27, 2017",
Officer in Sherman Park shooting waives hearing on sex assault charges,"Oct 27, 2016",
"Katy Perry, Marvel Universe Live! among new Milwaukee shows","May 20, 2017",
Man gets 37 years in domestic homicide,"Oct 10, 2016",
"42 years later, train ticket receipt leads to man's identity","Aug 10, 2017",
Egypt Air Paris to Cairo flight missing from radar,"May 17, 2016",
"Carjacking, shootout with officer brings 33-year-sentence","May 11, 2016",
Stingl: You can be Trump or Hillary if you dare,"Oct 7, 2016",
Investigators wrongly said teen prison probe ended,"Mar 8, 2017",
Oscars 2017: Where and how to watch this year's winners,"Feb 27, 2017",
Inquest ordered in inmate's dehydration death,"Feb 22, 2017",
Mayer's legacy is diminishing at Yahoo,"Oct 18, 2016",
First Stage hits target with hilarious 'Robin Hood',"Feb 18, 2017",
Obituary: Wyzbinski guided non-profits,"Sep 14, 2016",
Looking for classic-hits playlist? Go to the movies,"May 4, 2017",
Mequon man seeks to withdraw homicide plea,"Sep 3, 2016",
Christian Schneider: Trump and the death of political humility,"Mar 24, 2016",
Youth at Lincoln Hills given wrong meds — twice,"May 9, 2016",
Carolyn Hax: Try understanding before confronting,"Aug 20, 2016",
Teen inmates allege excessive pepper spraying,"Jan 26, 2017",
Carolyn Hax: Try understanding before confronting,"Aug 20, 2016",
Youth at Lincoln Hills given wrong meds — twice,"May 9, 2016",
"Stingl: A big life, a very short death notice","Aug 27, 2016",
Christian Schneider: Trump and the death of political humility,"Mar 24, 2016",
Plant closings feed French populist movement,"Apr 18, 2017",
Anxious? Deeply depressed? More college students saying yes,"May 11, 2016",
Man pleads not guilty to gun charges,"Aug 8, 2016",
Charges filed in death of UW-Stout Saudi student,"Jan 13, 2017",
"Brit Bennett, Nickolas Butler among visiting authors","Jan 13, 2017",
Show Guide Aug. 21-27,"Aug 19, 2016",
Concert Review: Holy Holy brings the joy of David Bowie to Turner Hall Ballroom,"Apr 12, 2016",
"Letters for March 26: Trump and Merkel, Abele","Mar 25, 2017",
Third graders try to cope with trauma,"Jun 10, 2017",
Crisis at Lincoln Hills juvenile prison years in making,"Jan 6, 2017",
Precious Lives: Firefighter copes with trauma as emergency calls stream in,"Mar 20, 2016",
Emily Mills: GOP convention offered disturbing sign of things to come,"Jul 22, 2016",
What's new on (and leaving) Hulu in September,"Aug 23, 2017",
Panel sidesteps open meetings law for prison tour,"Mar 10, 2017",
Facebook finally gets serious about fighting fake news,"Dec 15, 2016",
Facebook finally gets serious about fighting fake news,"Dec 15, 2016",
"Album Reviews: John Legend, more","Dec 9, 2016",
Christian Schneider: Donald Trump: Dead candidate walking,"Jul 1, 2016",
"ZZ Top, Lewis Black among new Milwaukee concerts","May 25, 2017",
Emily Mills: Bearing the brunt of hate,"Jun 16, 2016",
Gary D’Amato: Golfer Ken Green the ultimate survivor,"Jun 20, 2016",
WIAA Division 1 State Baseball Tournament: Burlington breaks through late for 6-4...,"Jun 15, 2016",
CIA: ‘No sign’ of ISIS ties in Orlando shooting,"Jun 15, 2016",
Officials: Suspect vowed allegiance to Islamic State at shooting scene,"Jun 11, 2016",
Oscars 2017: Where and how you can watch this year's nominees,"Feb 10, 2017",
Sports briefs Tuesday,"May 23, 2016",
Oscars 2017: Where and how you can watch this year's nominees,"Feb 10, 2017",
The Wisconsin Voter: To endorse or not: Ryan's Trump dilemma,"May 14, 2016",
Inquest jury recommends charges against 7 in jail death,"May 2, 2017",
Oscar watch: How and where to see 2017's nominees,"Feb 2, 2017",
"Election 2016: Bradley, Kloppenburg clash again during debate","May 25, 2016",
"Letters for Sunday, Sept. 18","Sep 17, 2016",
Stratford plays highlights women's stories,"Aug 1, 2017",
Brown Deer officer charged in shooting,"Oct 22, 2016",
'Airness' a fabulous play about joy of pretending,"Apr 7, 2017",
'Airness' a fabulous play about joy of pretending,"Apr 7, 2017",
Families of loved ones at VA soon will find comforts of home,"Mar 30, 2016",
Vets' mission focus of 'Almost Sunrise',"Sep 27, 2016",
"Movies: Opening this week — 'Eye in the Sky,' 'God's Not Dead 2,' more","Mar 30, 2016",
Sensenbrenner faces two challengers,"Oct 9, 2016",
Trudy Rubin: A Yazidi woman’s story of horror,"Mar 18, 2016",
"Broadway shows profile conflict, imagine communities","Mar 31, 2017",
"What's new on Netflix, Hulu, Amazon Prime: June 30-July 6","Jun 29, 2017",
What's coming to Amazon Prime in July 2017,"Jun 21, 2017",
Death in County Jail ruled homicide,"Sep 15, 2016",
Death in County Jail ruled homicide,"Sep 15, 2016",
"What's new on Netflix, Hulu, Amazon Prime this week","Sep 28, 2017",
Mass killings spark demand for active shooter training,"Feb 23, 2016",
"Gay pop star Sivan breaks ground, amasses teen following","Feb 17, 2016",
New album releases for March 3,"Mar 1, 2017",
"New on DVD: 'Hell or High Water,' 'Eight Days a Week,' more","Nov 17, 2016",
"D'backs 9, Brewers 3: Nelson hit hard","Aug 7, 2016",
D'Amato: Getting to Rio no day at the beach,"Aug 4, 2016",
Where and how to watch this year's Oscar nominees,"Feb 23, 2017",
Controversy engulfs Trump,"Aug 2, 2016",
"President, Senate top full ballot on Tuesday","Nov 7, 2016",
"New on DVD: 'Sausage Party,' more","Nov 8, 2016",
"Oscars 2017: How, where to watch this year's nominees","Feb 16, 2017",
Businesses make plans to protect workers during heat wave,"Jul 20, 2016",
Abuse survivor urges others to get help,"Oct 13, 2016",
"New DVD releases for June 28: 'Whiskey Tango Foxtrot,' 'Kung Fu Panda 3'","Jun 28, 2016",
"New DVD releases for July 5: 'I Saw the Light,' 'By the Sea,' more","Jul 5, 2016",
"From basic info to overdose video, prison records kept secret","Jun 19, 2016",
"Letters for Sunday, Jan. 8","Jan 7, 2017",
"Letters for Sunday, Jan. 8","Jan 7, 2017",
Wisconsin joins suit over Obama transgender bathroom rules,"May 24, 2016",
Daniel Bice: Where is home for congressional hopeful Frank Lasee?,"May 13, 2016",
"New on DVD: 'Sully,' 'Magnificent Seven,' more","Dec 20, 2016",
New corrections chief builds trust using old tactic: listening,"May 28, 2016",
"New on DVD: 'Jason Bourne,' 'Secret Life of Pets,' more","Dec 6, 2016",
Our Back Pages: Earth-shaking fire guts east side's Century Hall — in 1988,"Apr 18, 2016",
"New on DVD: 'Don't Breathe,' 'The BFG,' more","Nov 29, 2016",
Rebecca Bradley beats JoAnne Kloppenburg in high court race,"Apr 4, 2016",
Troubled Lincoln Hills facing heavy staff vacancies,"Apr 15, 2016",
Appleton teen makes heartbreaking decision to die,"Jul 15, 2016",
Van Mobley: Trump and Sanders are exorcising the free trade hobgoblin,"Mar 18, 2016",
"New on DVD: 'Bad Moms,' 'Star Trek Beyond'","Nov 1, 2016",
Mother in Slender Man stabbing struggles with daughter’s fate,"Jun 20, 2016",
Panic! at the Disco among new concert announcements,"Sep 22, 2016",
Mother of Antigo prom shooter grapples with horrors,"May 11, 2016",
Kris Kristofferson among new concerts,"Aug 25, 2016",
"New on DVD: 'Snowden,' 'When the Bough Breaks,' more","Dec 27, 2016",
"New DVD releases: ‘Ride Along 2,’ ‘Son of Saul’","Apr 25, 2016",
"New on DVD: 'Snowden,' 'When the Bough Breaks,' more","Dec 27, 2016",
Summer movie guide 2016: What's opening in Milwaukee,"Apr 6, 2016",
"Rebecca Bradley in 1992: Scorn for ‘queers’ with AIDS, addicts","Mar 6, 2016",
'Experience Hendrix' among new concert announcements,"Oct 6, 2016",
"Top shows this week: Foals and Silversun Pickups, Punch Brothers and more","May 4, 2016",
KKK incident at Westosha High underscores racial bullying,"May 7, 2016",
Frankie Valli among new concert announcements,"Sep 29, 2016",
Those Hip Hop Guys Guide to the 2016 Milwaukee Film Fest,"Sep 21, 2016",
"New DVD releases: ‘The Forest,’ ‘Standoff,’ ‘Flight 7500’","Apr 11, 2016",
Those Hip Hop Guys Guide to the 2016 Milwaukee Film Fest,"Sep 21, 2016",
New albums in stores this week,"Apr 13, 2016",
Milwaukee movie guide: What's playing where,"May 11, 2016",
New albums out this week,"Feb 17, 2016",
Precious Lives: 'The team to beat',"Jan 4, 2017",
"For two Syrian brothers, a new home in Milwaukee","Jan 6, 2017",
"Deaths in arts, entertainment in 2016","Dec 29, 2016",
"Day Out: For 70 years, Ducks have been a Dells family tradition","Aug 28, 2015",
Milwaukee movie guide: What's playing where,"Feb 17, 2016",
Milwaukee movie guide: What’s playing where Nov. 18-24,"Nov 17, 2016",
Milwaukee movie guide: What's playing where,"Feb 24, 2016",
New albums in stores this week,"May 10, 2017",
Milwaukee movie guide: What’s playing where Nov. 11-18,"Nov 10, 2016",
New albums in stores this week,"May 11, 2016",
"Seinfeld, R. Kelly among new concerts","Oct 27, 2016",
Milwaukee movie guide: What’s playing where Nov. 4-10,"Nov 3, 2016",
Milwaukee movie guide: What’s playing where Oct. 28-Nov. 3,"Oct 27, 2016",
Rating the NFL draft prospects: Wide receivers and tight ends,"Apr 20, 2016",
Milwaukee movie guide: What's playing where,"May 4, 2016",
Milwaukee movie guide: What’s playing where Oct. 14-20,"Oct 13, 2016",
Milwaukee movie guide: What’s playing where Sept. 30-Oct. 6,"Sep 30, 2016",
Rating the NFL draft prospects: Wide receivers and tight ends,"Apr 20, 2016",
Milwaukee movie guide: What's playing where,"Apr 6, 2016",
Milwaukee movie guide: What's playing where,"Apr 13, 2016",
Milwaukee movie guide: What’s playing where Sept. 23-29,"Sep 22, 2016",
Milwaukee movie guide: What’s playing where Aug. 26-Sept. 1,"Aug 25, 2016",
Milwaukee movie guide: What’s playing where,"Sep 8, 2016",
Trans-Siberian Orchestra among new concerts,"Aug 18, 2016",
Milwaukee movie guide: What’s playing where Aug. 12-18,"Aug 12, 2016",
Eric Church among new concerts,"Aug 11, 2016",
Milwaukee movie guide: What’s playing where Aug. 19-25,"Aug 18, 2016",
Concert update Aug. 19,"Aug 18, 2016",
Milwaukee movie guide: What's playing where,"Jul 28, 2016",
Milwaukee movie guide: Aug. 5-11,"Aug 4, 2016",
Milwaukee movie guide: What’s playing where Oct. 21-27,"Oct 20, 2016",
Milwaukee movie guide: Sept. 16-22,"Sep 15, 2016",
Wisconsin's 10 most haunted places,"Oct 18, 2013",
Milwaukee movie guide: What's playing where,"Apr 20, 2016",
Milwaukee movie guide: What's playing where,"Mar 30, 2016",
Milwaukee movie guide: What's playing where,"Mar 2, 2016",
