Title,Date,Blurb
You have a chance to save a life,"Jun 15, 2014",
Large arrest puts dent in heroin market,"Feb 18, 2016",
Delaware to get federal money to combat heroin epidemic,"Aug 17, 2015",
Dover police start Angel program,"Jun 30, 2016",
High school report,"Apr 1, 2017",
Exchanging needles for second chance,"Sep 23, 2014",
Exchanging needles for second chance,"Sep 23, 2014",
Work together to combat addictions,"Jun 16, 2014",
10 new health laws that could impact you,"Jul 14, 2016",
Letters: Time to stop drug addiction,"Jan 29, 2015",
We don't know how to stop the demand for drugs,"Feb 4, 2014",
Suicide by cops: Did anxiety from heroin push Brandon and Chelsea to their deaths?,"Nov 21, 2016",
Be Accepting: The Reality of Addiction,"Dec 1, 2015",
State to open downstate detox center,"Oct 29, 2014",
Dose of good news for AstraZeneca,"Dec 13, 2013",
How to tell if someone is addicted,"Nov 3, 2014",
State to open downstate detox center,"Oct 29, 2014",
Delaware legislators debate poverty fix,"Apr 5, 2016",
Heroin babies: Starting life in withdrawal,"Nov 22, 2015",
Can Delaware win war with addiction?,"Jun 15, 2014",
Delaware is full of heroin's heartaches,"Jan 28, 2015",
Medical marijuana patients in limbo,"Sep 4, 2016",
When heroin and painkillers come together,"Feb 8, 2014",
Delaware can learn from fishing village fighting heroin,"May 21, 2016",
Thankful every day,"Nov 26, 2013",
Types of drug treatment in Delaware,"Dec 29, 2014",
Will Delaware soon legalize marijuana?,"Dec 14, 2014",
CDC intervention plan for Wilmington teen violence lacks political will,"Sep 10, 2017",
Heroin treatment far away,"Oct 20, 2014",
