Title,Date,Blurb
Theft charge for Sen. Hall-Long's husband,"Oct 30, 2014",
Delaware can learn from fishing village fighting heroin,"May 21, 2016",
"Breathe, and keep stress at bay during Black Friday grind","Nov 27, 2013",
Fitness can help addicts recover,"Mar 17, 2015",
Stressed by shopping? Here’s how to unwind during Black Friday grind,"Nov 28, 2013",
Decode your nose: allergies or cold?,"Apr 28, 2015",
"Death of man, 22, may be tied to drinking","May 30, 2014",
Win-hungry Hens seek happy ending,"Nov 16, 2015",
More treatment key for addicted moms,"Mar 4, 2016",
Winning the Beast matter of survival,"Dec 18, 2014",
Non-FDA approved dropless cataract surgery gains steam,"Sep 21, 2015",
"Tough love comes with heartache, hope","Dec 22, 2014",
Letters: Heroin's dangers,"Oct 22, 2014",
Letters: Heroin's dangers,"Oct 22, 2014",
Dover's C-Rock back with 'Dope Daze 2',"Aug 28, 2014",
Opioids: a gateway drug,"Oct 28, 2014",
Lloyd Webber's sexy 'Stephen Ward' seduces some,"Dec 22, 2013",
"Molly believed safe, but it’s risky","Aug 3, 2015",
"Oh, the secrets Chip Kelly keeps","Jul 26, 2015",
Learning a lesson from a win over illegal drugs,"Dec 17, 2013",
Vince Vaughn flexes drama muscles in 'Delivery Man',"Nov 23, 2013",
The 'War on Drugs' is not over,"Jul 19, 2014",
Overcome addictions with DE programs,"Jul 7, 2014",
Whedon juggles big cast in 'Ultron',"Apr 30, 2015",
Downstate Delaware awaits new detox center,"Aug 13, 2015",
No working smoke detectors in fatal Wilmington fire,"Jan 14, 2016",
Suicide by cops: Did anxiety from heroin push Brandon and Chelsea to their deaths?,"Nov 21, 2016",
Recovering addict races to redemption,"May 15, 2015",
Be Accepting: The Reality of Addiction,"Dec 1, 2015",
Heroin babies: Starting life in withdrawal,"Nov 22, 2015",
GOP takes aim at state Senate,"Oct 16, 2016",
Searching for treatments that work,"Jun 15, 2014",
Clean out prescription drugs at event,"Sep 23, 2014",
Christiana Care proposes $250 million expansion,"Jan 22, 2015",
"Firefly's class system: Are you a VIP, Super VIP or roughing it like the rest of us?","Jun 21, 2014",
Budget: Millions in senior tax breaks cut,"Jan 30, 2015",
Legislature OKs casino bailout as session ends,"Jul 1, 2014",
Gambling addiction: beyond the bets,"Dec 16, 2014",
Turning to meditation for some me-time in today’s busy world,"Feb 24, 2014",
The heroin treatment many in Delaware don’t know about,"Jul 8, 2016",
The Daily Scroll: June 30,"Jun 30, 2016",
Fight 50 years ago launched Ali as icon,"Feb 22, 2014",
'Glee' star Morrison plays Grand Gala with Delaware Symphony Orchestra,"Dec 5, 2013",
Delaware police: New attack on heroin working,"Jun 16, 2014",
Addiction clinic Crossroads has past problems with state,"Sep 13, 2015",
"Heroin in Delaware: Cheap, pure, plentiful","Jun 15, 2014",
"‘Breaking Bad,’ ‘Modern Family’ crowned at Emmys","Sep 23, 2013",
Details emerge in bones mystery,"Oct 10, 2013",
Strange details emerge after Del. woman’s bones identified,"Oct 9, 2013",
"In Delaware, you could be buying a house of horrors and never know it","Oct 30, 2013",
Treatment centers scarce in Delaware,"Jun 17, 2014",
Vermont's heroin war targets supply,"Jun 15, 2014",
In the grips of a heroin epidemic,"Jun 15, 2014",
High school report,"Sep 27, 2015",
Heroin treatment far away,"Oct 20, 2014",
