Title,Date,Blurb
Overdose,"Sep 14, 2018",
Memorializing overdose victim gives fuel to outreach volunteers,"Sep 14, 2018",
Delaware mother turns 'pain into purpose' after son's overdose,"Sep 24, 2018",
Mother turns son's death into a purpose,"Sep 19, 2018",
"Treatment options still lag in Delaware, says report","Oct 11, 2018",
"Officers, firefighters overcome by substance","Sep 7, 2018",
Shattered lives: Remembering those lost to overdoses,"Aug 31, 2018",
"Fentanyl exposure hospitalizes firefighters, police","Sep 7, 2018",
"Fan blew opioid fentanyl on first responders, sending them to hospital","Sep 10, 2018",
"Film 'Gosnell' recalls Wilmington, Philly abortion doctor's horrors","Oct 11, 2018",
"A moment from death, overdose victim is saved","Aug 1, 2018",
Increase in heroin overdoses fuels Narcan distribution,"Aug 8, 2018",
UD police: on-campus death was likely overdose,"Jun 3, 2018",
Overdose deaths inspire effort to give homeless naloxone,"Jul 31, 2018",
"When drugs kill your child, here's what you do","Jul 13, 2018",
Legal protection expanded for overdose drug use,"Jun 13, 2018",
Data-sharing issues slow fatal overdose reviews,"Jul 15, 2018",
Report calls for 'major action' in fight against addiction,"Jul 24, 2018",
"OD at UD not typical for campus, officials say","Jun 4, 2018",
Answers sought in baby sister's heroin overdose,"Apr 23, 2018",
One a day: Delaware's addiction epidemic worsens,"Jun 11, 2018",
Opioid tax would help battle the addiction crisis,"Jun 8, 2018",
Lawyer for troubled psychiatrist has license suspended,"Jun 8, 2018",
Hold drug companies accountable for opioid crisis,"May 7, 2018",
Nation’s top doc supports safe injection sites,"May 24, 2018",
Buried in her prom dress: What heroin takes,"Apr 23, 2018",
Wilmington firefighters will soon carry overdose drug,"Dec 17, 2017",
"After overdoses, outreach teams could be answer","Mar 15, 2018",
Overdose-related emergency room visits spike in Delaware,"Mar 6, 2018",
Wilmington Trust execs should face consequences,"May 7, 2018",
Fact check: Do 'safe-injection' sites help?,"Apr 5, 2018",
Overdose-related visits to ER surge in Delaware,"Mar 6, 2018",
Talk about Easter in the present tense,"Apr 1, 2018",
"7 dead, 40 survived in latest Delaware overdose spike","May 1, 2018",
1st medical marijuana dispensary to open in Philly,"May 3, 2018",
Where to take medication on Drug Take-Back Day,"Apr 24, 2018",
Wilmington Fire Dept. will carry overdose drug,"Dec 17, 2017",
Fentanyl-laced heroin found at Wilmington Port,"Apr 20, 2018",
Heroin overdoses leave scars on our hearts,"Apr 18, 2018",
Opioid prescriptions have dropped 14 percent,"Apr 19, 2018",
Mom whose son died of overdose creates support group,"Apr 17, 2018",
Leftover opioids? Walmart has a solution,"Mar 12, 2018",
Deadly fentanyl-laced heroin could be in Delaware,"Apr 10, 2018",
Bill would give Narcan to more public employees,"Jan 24, 2018",
AG: Suspended Dover psychiatrist doctoring records,"Apr 3, 2018",
Don't blame doctors for the opioid crisis,"Feb 20, 2018",
"In Delaware, the race against addiction grows","Mar 5, 2018",
'Modern-day slavery' still misunderstood in Delaware,"May 6, 2018",
Six prison overdoses means officers carry Narcan,"Mar 28, 2018",
"Big Pharma must face opioid lawsuit in Delaware, judge rules","May 2, 2018",
A drug crackdown won't solve the opioid crisis,"Mar 22, 2018",
Mailbag: Stop being divisive and disruptive,"Mar 20, 2018",
"Grief, loss and hope in the holidays: Dialogue","Dec 22, 2017",
Can Delaware do better in opioid fight? Here's how it's trying,"Oct 3, 2018",
Moms deluge Trump with addiction message,"Feb 18, 2018",
Keep up the pressure on drug companies,"Feb 16, 2018",
Denn calls for state money for drug treatment,"Feb 14, 2018",
"After tough year, Del. awaits final overdose count","Jan 9, 2018",
"In opioid fight, focus on treatment, not safe sites","Mar 30, 2018",
US Attorney: We're hounding the people responsible for the opioid crisis,"Sep 24, 2018",
Delaware's OD count may be worse than it appears,"Oct 25, 2017",
Delaware's overdose death toll rises to 171,"Oct 10, 2017",
Three fatal overdoses Wednesday across New Castle County,"Dec 13, 2017",
Could safe injection sites come to Delaware?,"Mar 23, 2018",
UD class trains students to become EMTs,"Jan 30, 2018",
Dr. Wilson Compton to talk addiction Wednesday,"Jan 23, 2018",
Naloxone access saves lives: Dialogue Delaware,"Oct 3, 2017",
Overdose spike kills 11 over Thanksgiving weekend,"Nov 27, 2017",
Delaware programs get $325K to fight opioid epidemic,"Feb 26, 2018",
Delaware ranked 30th among states in health report,"Dec 20, 2017",
What Delaware's opioid lawsuits may accomplish,"Feb 13, 2018",
"900 in Del. could receive addiction treatment, state says","Feb 16, 2018",
Opioid crisis hits home for mother who lost son,"Aug 11, 2017",
End marijuana prohibition: Delaware Voices,"Oct 4, 2017",
WATCH LIVE: Opioid addiction forum at Dickinson HS,"Dec 4, 2017",
Kick out politicians for harassment: Letters,"Dec 3, 2017",
Our chance to show hope against heroin: Editorial,"Dec 2, 2017",
Pharmacists can sell overdose antidote over the counter,"Jul 20, 2017",
W.Va. officials look to Delaware for answers to opioid crisis,"Jan 31, 2018",
New law gives better access to naloxone,"Jul 20, 2017",
W.Va. officials look to Delaware for answers to opioid crisis,"Jan 31, 2018",
"Thumbs up for more Narcan, down for border wall","Sep 22, 2017",
"Top stories for Tuesday, September 19","Sep 19, 2017",
A new step in ending opioid crisis: Dialogue,"Jan 11, 2018",
Take politics out of opioid crisis: Editorial,"Oct 26, 2017",
Correctional officer sentenced after smuggling drugs and phones into prison,"Jan 4, 2018",
"Narcan kits to be carried on patrol, police say","May 27, 2017",
"Exchanging needles, saving lives","Dec 27, 2017",
Why holidays are hard for those struggling with addiction,"Dec 22, 2017",
County police secure funding for Hero Help coordinator,"Dec 21, 2017",
AG Matt Denn takes on Big Pharma in opioid lawsuit,"Jan 19, 2018",
State of emergency for opiates could help treatment,"Aug 11, 2017",
A school for Delaware's youngest struggling with addiction,"Dec 2, 2017",
Local volunteer fire companies get life-saving Narcan,"Sep 19, 2017",
Treatment 'too difficult to access' for many in Delaware,"Dec 4, 2017",
"Doctors, pharmacists, addiction experts at heroin resource fair","Dec 4, 2017",
"Delaware considering safe heroin injection sites, pushing for Obamacare extension","Dec 7, 2017",
Donation gets naloxone in the hands of volunteer firefighters,"Sep 18, 2017",
Six overdose deaths linked to two heroin brands,"Jul 26, 2017",
Del. AG pushes state to invest in fighting addiction,"Dec 3, 2017",
"Addiction and its treatment are complex, layered","Jun 28, 2017",
What heroin costs Delaware — in lives and money,"Dec 2, 2017",
Delaware shocked heroin took an addiction champion,"Nov 29, 2017",
Letters to the editor: Lessons sports teach us,"Jun 10, 2017",
"Doctor memorializes woman she once saved from overdose, helps more in Dover","Sep 17, 2018",
Apparent overdose victim saved in New Castle County,"Jun 22, 2016",
Delaware reports 12 percent drop in opioid prescriptions,"Nov 8, 2017",
Physicians can help end opioid crisis: Voices,"Nov 3, 2017",
Physical therapy an alternative to opiods: Voice,"Oct 26, 2017",
Delawareans 'underwhelmed' by Trump's opioid response,"Oct 26, 2017",
Trump health care sabotage hurts Delaware: Voices,"Oct 20, 2017",
Officer halts overdose with Naloxone,"Sep 23, 2016",
Letters to the editor: Where to park at the riverfront?,"May 2, 2017",
Wilmington doctor charged with illegally prescribing oxycodone,"Oct 13, 2017",
GOP health care plan victimizes opioid addicts,"Jun 26, 2017",
Patrol officers save life with Narcan,"Jun 29, 2016",
23 police departments get naloxone,"Jun 2, 2016",
No link found yet in heroin overdoses,"Mar 27, 2017",
Delaware sees deadliest month ever from drug overdoses,"Sep 11, 2018",
Take hard line on prescription drug abuse,"Feb 1, 2017",
Feds must step up in addiction fight: Voices,"Aug 18, 2017",
AG closes 'The Hole' — open air drug market near Greenwood,"Aug 18, 2017",
Man arrested after meth lab bust in Dover,"Jan 11, 2017",
Treat heroin crisis like the emergency it is: Editorial,"Aug 11, 2017",
Fentanyl: What it is and why it's deadly,"Sep 7, 2018",
Delaware fentanyl overdoses reach 90 in nine months,"Dec 12, 2016",
Moving beyond the heroin trap,"Aug 23, 2016",
"Rescued once, mom can't be saved from second overdose","Sep 12, 2018",
Poll: Do you think schools should have the overdose-reversing drug naloxone?,"Apr 24, 2015",
AG Denn to release 8-point plan in combating heroin epidemic,"Sep 6, 2017",
Delaware AG Matt Denn wants addiction recovery high school,"Sep 6, 2017",
"Pennsylvania man arrested for drugs, DUI in Dover","Mar 2, 2017",
Man indicted on drug charges in fentanyl-related death,"Feb 16, 2017",
Accused heroin dealer is charged in death,"Oct 23, 2016",
Fentanyl-related overdoses triple in 2016,"Feb 14, 2017",
KJWP NewsBreak: Wilmington teen accidentally shoots himself,"Jun 3, 2016",
Bucci's daughter died of multi opiate overdose,"May 20, 2016",
Delaware health cuts could hurt the neediest,"Jun 6, 2017",
KJWP NewsBreak: Dover officer will not be charged in shooting,"Jun 2, 2016",
Delaware pulls 3 doctors' prescribing privileges,"Jan 31, 2017",
Delaware takes bold step to battle addiction,"May 30, 2017",
Stories of heroin addiction hope to help others,"May 23, 2017",
180 charged with underage drinking,"Sep 20, 2016",
New heroin commission superfluous,"Apr 22, 2016",
2 dead in overdose spike in Sussex,"Apr 24, 2017",
Next steps in reducing Del. OD deaths,"Aug 16, 2015",
Sister's overdose affects teen,"Jun 23, 2014",
Fentanyl-related overdose deaths in Delaware continue to rise,"Jun 22, 2016",
Delawareans turn in thousands of pounds of pharmaceuticals,"Jun 4, 2017",
Denn: Better access to addiction treatment still needed,"Oct 19, 2016",
Review: ‘Age of Ultron’ is an Avengers overdose,"Apr 28, 2015",
New commission to target heroin,"Apr 21, 2016",
"Despite rain, vigil held to honor International Overdose Awareness Day","Sep 1, 2016",
8 deaths in 4 days from suspected overdoses in Delaware,"Aug 14, 2018",
Narcan to be available over the counter in Delaware,"Feb 26, 2016",
Delaware gets another $1 million Narcan donation,"Feb 23, 2016",
"Delaware gets 2,000 heroin overdose kits","Aug 26, 2015",
FDA approves device to reverse opioid overdose,"Apr 7, 2014",
Delaware fentanyl-related overdose deaths jump,"Dec 28, 2015",
Woman found dead in restaurant men's room,"Oct 29, 2015",
Delaware House OKs overdose drug naloxone in schools,"Apr 24, 2015",
Police save woman from heroin OD,"Oct 26, 2015",
Stiffer penalties on drug dealers would help opioid crisis,"Sep 17, 2018",
Family feels lasting effect of overdose death,"Jun 16, 2014",
Two lives saved with community naloxone training,"Sep 9, 2015",
AG pushes price cut for heroin antidote,"Aug 24, 2015",
Middletown woman saved from heroin OD,"Aug 3, 2015",
Government evolving to meet heroin challenge,"Aug 22, 2015",
State: lethal drug mix looks like heroin,"Jan 16, 2015",
State: lethal drug mix looks like heroin,"Jan 16, 2015",
Bills attack heroin overdoses,"Jan 20, 2016",
'Narcan' could save Delaware lives,"Jun 4, 2014",
Reality show creates New Castle scene,"Sep 27, 2015",
Delaware latest state to take prison precautions,"Aug 30, 2018",
Narcan may be more easily available,"Jun 20, 2014",
Letters: Time to stop drug addiction,"Jan 29, 2015",
Bill to prepare relatives of addicts,"May 14, 2014",
Senate OKs OD-drug bill,"Jun 5, 2014",
Delaware to get federal money to combat heroin epidemic,"Aug 17, 2015",
Denn announces attack plan on heroin,"Aug 7, 2015",
FBI recovers pair of Garland's ruby slippers from 'Wizard of Oz',"Sep 4, 2018",
Addiction and re-incarceration are a vicious cycle. Here's how we can break it.,"Aug 29, 2018",
Woman arrested at fishing area on drug charges,"Aug 1, 2018",
Narcan to get wider use for heroin OD,"Nov 28, 2014",
Abortion tech from Bear gets prison term,"Mar 14, 2014",
Events set on fighting heroin's spread,"Sep 15, 2014",
"Brothers arrested on drug, weapons charges after 911 call","Dec 27, 2013",
Sussex County sees 4 of last 5 fatal drug ODs,"Jul 16, 2018",
Small-town police now face a big heroin problem in Delaware,"Aug 2, 2018",
"Father shares story of loss, hope","Jun 8, 2014",
"DO Delaware: 12 themed drinks for your weekend, and only 1 is a hurricane","Sep 13, 2018",
3 involved in DUI crash at Prices Corner gas station,"Aug 21, 2018",
Food Bank of Delaware opens 2 new training programs,"Sep 5, 2018",
Opioid epidemic: Father's heartbreaking photo goes viral,"Aug 7, 2018",
"Man overdosed, left sex worker with child: police","Aug 7, 2018",
What's New Now: Seymour Hoffman films at Theatre N,"Mar 20, 2014",
"Man walked into fire station with serious burns, fire marshal investigating","Jul 13, 2018",
"Amid opioid crisis, this recovery program struggles for money","Aug 21, 2018",
Addiction solutions prove difficult in Delaware,"Jul 12, 2018",
2 overdosed in past month at women's prison,"Aug 1, 2018",
Overdose deaths spike in Sussex County,"Jul 18, 2018",
Warning: 2 deaths involve same-stamp heroin packets,"May 28, 2018",
Looking for heroin treatment? Try asking police,"Aug 10, 2018",
The News Journal obituaries for July 16,"Jul 16, 2018",
Man rescued from truck tank near New Castle,"Jun 5, 2018",
Little boy wants to be cop after officer helps family,"Jun 4, 2018",
Marijuana can help us fight the opioid epidemic,"May 23, 2018",
Eagles shouldn't follow Cowboys on anthem protests,"Aug 15, 2018",
Don't lose sense of urgency on opioid crisis,"Jul 13, 2018",
Drug companies should help fund opioid battle,"Apr 19, 2018",
"When police K-9s get hurt on duty, what happens next?","Aug 6, 2018",
"Motorist found in pond charged with DUI, heroin","May 22, 2018",
Dentist helps patients suffering without sleep,"Jul 3, 2018",
"Lawsuit: doctor, pharma collusion caused addiction","May 13, 2018",
"Powerful lawyer, Dem donor drops UD nomination","Jun 9, 2018",
Burger King reopens after viral video of rats,"Jun 5, 2018",
Time to listen to Delawareans and legalize marijuana,"Jun 21, 2018",
"Wawa robbed takes cash, coffee, cigarettes","Jan 10, 2018",
Dover psychiatrist's license on the line,"May 29, 2018",
These are the leading causes of death in Delaware,"May 15, 2018",
What you need to know about the opioid crisis in Delaware,"Oct 26, 2017",
Police: Teen shot himself in foot near New Castle,"Oct 10, 2017",
Ceremonies honor fallen Delaware officers,"May 2, 2018",
Advocate: Marijuana is safer than opioids.,"Feb 15, 2018",
NJ town shaken by fatal Del. 1 crash that killed family,"Jul 16, 2018",
"Plan calls for better mental health, addiction care","May 15, 2018",
Wilmington officer remembered as selfless father,"Mar 7, 2018",
Delaware needs a recovery high school to fight opioid crisis,"May 9, 2018",
"Addiction support needs more funding, advocates say","May 8, 2018",
Highmark limits opioid prescriptions for first-time users,"Feb 15, 2018",
"Mr. Mayor, tear down those red light cameras","Mar 22, 2018",
He used to shoot heroin out back. Now his music draws crowds to the stage.,"May 1, 2018",
"UD, Newark police gear up for St. Patrick's Day","Mar 12, 2018",
State employees to receive training in trauma,"Mar 19, 2018",
Social workers offer help on clients' turf,"Jan 10, 2018",
90 dead from fentanyl overdoses this year,"Dec 12, 2016",
Carney: Opioid fight vital for Delaware,"Aug 5, 2016",
Man charged with firing gun at an Ogletown bar,"Jul 21, 2017",
Another reason to fight opioid addiction: Economics,"Mar 7, 2017",
More must be done for those that need it the most,"Oct 19, 2016",
Newark police revive two with Narcan in first month,"Dec 1, 2015",
Neighborhood raises money to bury mother of three,"Jul 18, 2017",
Addiction treatments must change,"Mar 22, 2017",
Letters to the editor: The power of Trump's words,"Feb 26, 2017",
'People will die' under new health care proposal,"Jun 23, 2017",
Opioid coverage doesn't impress: Letters,"Oct 30, 2017",
Officers save man's life with Naloxone,"Jun 7, 2016",
Opiate addiction focus of UD research,"Sep 4, 2016",
Opiate addiction focus of UD research,"Sep 4, 2016",
Woman charged in prescription forgeries,"Aug 10, 2017",
Wrenching film shows heroin's impact,"Jan 10, 2016",
Philadelphia to mull safe injection sites in opioid fight,"May 19, 2017",
For patient's rights: Do not repeal the Affordable Care Act,"Jan 17, 2017",
We can stop holiday addiction deaths: Voice,"Dec 16, 2017",
Painkiller pulled at FDA request due to abuse,"Jul 7, 2017",
Man charged with Ogletown shooting,"Aug 31, 2016",
Three quiet words saved Delaware woman's life,"Dec 2, 2017",
Delaware fears more heroin overdoses,"Apr 24, 2017",
AG: Suspend psychiatrist who bartered drugs for guns,"Mar 17, 2018",
Del. paramedics are pressed by dwindling dollars,"Jan 31, 2018",
"Editorial: We are failing veterans, men and women","May 27, 2017",
Delaware joins 35 states in Suboxone suit,"Sep 23, 2016",
Narcan becomes common tool for Delaware police,"May 22, 2016",
Seaford-area man charged with child porn,"Apr 25, 2017",
Veterans with PTSD need easier access to cannabis,"Apr 18, 2017",
Time to clean out your medicine cabinet,"Apr 10, 2017",
A vicelike grip on government spending,"Aug 24, 2015",
Mrs. B's Christmas tree endures after mom's death,"Feb 17, 2018",
State AGs investigating root of opioid crisis,"Jun 15, 2017",
State pushes stricter prescribing guidelines for pain pills,"May 17, 2016",
Fifth man charged in large fentanyl bust sentenced,"Jun 9, 2017",
NCCo turns down federal money for new police,"Dec 19, 2017",
5 teens charged for illegal guns,"Aug 26, 2015",
4 dead in one day from heroin,"Mar 27, 2017",
Maryland opioid drug rings have ties to Delaware,"May 26, 2017",
Feds should fight addiction differently: Voices,"Aug 26, 2017",
Letters to the editor: TransPerfect off target,"Sep 30, 2016",
Where Delaware gets its heroin,"Apr 24, 2017",
Delaware prisons names second-in-command,"Apr 25, 2017",
Letters to the editor: TransPerfect off target,"Sep 30, 2016",
Who is to blame for the opioid epidemic?,"Apr 4, 2017",
Where Delaware gets its heroin,"Apr 24, 2017",
Police: Harrington man makes threats,"Aug 7, 2014",
We've been down this addiction road before,"Sep 7, 2016",
New meaning to highway safety: Drugged driving,"Jan 10, 2017",
Celebrity birthdays June 24,"Jun 23, 2014",
Police union sues New Castle County,"Jul 28, 2017",
Delaware native Gambo on addiction and hip-hop connection,"Jan 25, 2017",
Bids for Rehoboth ocean outfall project revealed,"Jul 20, 2017",
Del. woman sentenced in Gosnell case,"Jun 27, 2014",
New meaning to highway safety: Drugged driving,"Jan 10, 2017",
Delaware officials fear drug treatment cuts,"Mar 18, 2017",
Advertise heroin dangers,"May 20, 2014",
State to launch addiction prevention campaign,"Dec 14, 2016",
"NCCo hosts free, public Narcan training","Oct 19, 2016",
Drug prevention forum set for Wednesday,"Sep 23, 2014",
Kent detox center gets $1M loan to expand services,"Jun 9, 2016",
"Event connects addicts, families with help","Oct 25, 2014",
Editorial: Feds' stance on marijuana impractical,"Sep 6, 2016",
Delaware tightens prescription drug rules,"Feb 1, 2017",
Delaware treatment system overtaxed,"Oct 19, 2014",
NCCo sponsors heroin forum at school,"Aug 21, 2014",
"'Change the world,' UD graduates told","May 27, 2017",
"AtTAcK Addiction, Connections partner to open recovery home","Aug 15, 2016",
The ‘settled’ consensus du jour,"Apr 23, 2016",
DO Delaware,"Jan 5, 2017",
End heroin's devastation in 2017,"Dec 29, 2016",
Guy's body issues puzzle partner,"Jun 24, 2014",
Delaware lawmakers push abortion bill,"May 8, 2017",
"For EMTs, hazards are part of the job","May 2, 2017",
New deaths from fentanyl-laced heroin,"Jun 6, 2014",
"Great local reporting, and its mission, needs saving","Apr 20, 2017",
Lobbyists work against opiate reforms,"Sep 19, 2016",
"Pediatricians say ""no"" to legalizing recreational marijuana","Apr 14, 2017",
A tough dose of heroin's toll,"Aug 23, 2014",
Sports dispatches July 10,"Jul 9, 2015",
The next steps in the heroin battle,"Aug 7, 2015",
Large arrest puts dent in heroin market,"Feb 18, 2016",
Addiction turns grandparents into caregivers,"Mar 25, 2017",
Lack of awareness helps sex traffickers in Delaware,"Mar 24, 2017",
Large arrest puts dent in heroin market,"Feb 18, 2016",
Letters to the editor,"Jan 20, 2016",
Few new funds to fight heroin epidemic,"Jul 14, 2016",
A key weapon in the fight against heroin,"Jun 13, 2014",
19-year-old suspected heroin dealer arrested,"Jun 10, 2016",
Film screening brings awareness to soldier suicide,"Mar 14, 2017",
"Health Briefs: Narcan training, mindfulness class","Oct 23, 2016",
Letters to the editor: Never forget the preamble,"Oct 17, 2016",
Letters to the editor: Never forget the preamble,"Oct 17, 2016",
Panel: Approach to drug war must change,"Mar 12, 2017",
Letters to the editor: Biden story not newsworthy,"Mar 6, 2017",
Letters to the editor: Give Dickinson credit,"Feb 22, 2017",
Letters to the editor: Helping Delawareans in need,"Feb 24, 2017",
You have a chance to save a life,"Jun 15, 2014",
"In a ‘change’ year, Sen. Portman deserves re-election","Sep 7, 2016",
Call to expand needle exchanges,"May 12, 2016",
Heroin battle is everybody's fight,"Jun 15, 2014",
Heroin battle is everybody's fight,"Jun 15, 2014",
We need honesty and plans from our politicians,"Aug 17, 2016",
Challenge of rescuing heroin addicts,"Jun 9, 2014",
Letters to the editor: Troops mistreated once again,"Jul 28, 2016",
6 ways to help control pain without drugs,"Jul 19, 2016",
Bills would open doors to drug treatment,"Mar 22, 2017",
"Heroin use needs a medical, not a moral, crusade","Feb 10, 2014",
"In Dover, help arrives from within","Dec 28, 2016",
"As Delaware heroin deaths rise, more treatment options sought","May 20, 2016",
Treatment components are key for addicts,"Jun 21, 2016",
Tip leads to heroin arrest in Fox Point,"Aug 25, 2017",
"As Delaware heroin deaths rise, more treatment options sought","May 20, 2016",
Treatment components are key for addicts,"Jun 21, 2016",
"For female vets, every day is struggle","May 27, 2017",
"Delaware police, fire reports roundup for June 29","Jun 29, 2016",
Rally for marijuana legalization held in Newark,"Dec 4, 2016",
Painkiller to heroin is an easy step,"Jul 11, 2015",
Heroin in Sussex: Groups battle denial,"Sep 18, 2014",
Delaware is full of heroin's heartaches,"Jan 28, 2015",
ARCHIVE: 'I blame the system',"Feb 17, 2017",
Forum details heroin epidemic's toll,"Jun 18, 2014",
'Robo trip' cough syrup bill passes legislature,"May 10, 2016",
ARCHIVE: 'I blame the system',"Feb 17, 2017",
Police save heroin OD victim,"May 19, 2015",
Recovery advocacy movement grows,"Nov 16, 2014",
"Event connects addicts, families with help","Oct 25, 2014",
"Man's ashes found in trash, returned","May 1, 2017",
Jefferson Award winners vow to keep city kids safe,"Apr 25, 2017",
New casino bailout plan on the way,"Jun 19, 2014",
"Event connects addicts, families with help","Oct 25, 2014",
"Drop-off unused, unwanted medicine Saturday","Apr 25, 2016",
GOP officials pitch other use for Wilmington money,"Apr 29, 2016",
Softer marijuana penalties advance in House,"Jun 19, 2014",
My experience marching against opioid abuse in Washington,"Sep 21, 2016",
Allen’s heroin ‘alert’ due in Elsmere,"Jul 19, 2014",
NCCo begins anti-heroin campaign aimed at kids,"Mar 13, 2015",
Shooting suspect faces heroin charges,"Mar 24, 2016",
Dover police start Angel program,"Jun 30, 2016",
State leaders: More addiction resources needed,"Sep 1, 2016",
The Daily Scroll: May 20,"May 20, 2016",
A middle ground on assisted suicide,"Nov 16, 2014",
NAACP leader talks civil rights in Delaware,"Aug 26, 2015",
Student sickened by heroin at school,"Nov 12, 2014",
Heroin addicts' families offered help,"Oct 25, 2014",
Heroin Alert program takes hard look at Delaware drug abuse,"Aug 5, 2015",
Legal pot? Is that what we want?,"Oct 18, 2014",
Marijuana leads to other drug use,"Mar 25, 2014",
State gets no new dollars for addiction treatment,"Jun 30, 2016",
Medications should be locked up,"Oct 1, 2014",
State gets no new dollars for addiction treatment,"Jun 30, 2016",
"In Sussex, heroin crime increased nearly 2,000%","May 26, 2016",
Nibali warps up Tour de France win,"Jul 27, 2014",
Bright spot in treatment of heroin addiction,"May 20, 2016",
"‘Glee’ episode says goodbye to Monteith, Finn","Oct 9, 2013",
Early education key in heroin battle,"Jun 15, 2014",
Letters: Looking back at history,"Aug 29, 2015",
"Markell highlights job growth, crime","Jan 22, 2015",
"While America rages, Delaware seems content","Nov 12, 2016",
NCCo honors emergency responders,"Mar 16, 2016",
Can Delaware win war with addiction?,"Jun 15, 2014",
"While America rages, Delaware seems content","Nov 12, 2016",
Health briefs for week of Oct. 21,"Oct 20, 2014",
Markell backs increased addiction services,"Jan 27, 2015",
We don't know how to stop the demand for drugs,"Feb 4, 2014",
Police warn of deadly fentanyl-laced heroin,"Jan 31, 2014",
Drug drop-off sites now set statewide,"Jun 8, 2015",
Home provides path back from addiction,"Jun 7, 2016",
Police warn of deadly fentanyl-laced heroin,"Jan 31, 2014",
NCCo police get Narcan to fight heroin ODs,"May 14, 2015",
"Brothers face drug, weapons charges","Dec 27, 2013",
NCCo's targeted police deployment proves effective,"Jan 16, 2016",
Decode your nose: allergies or cold?,"Apr 28, 2015",
